{
  "schema_version": "asset-studio.golden-job/v1",
  "job_id": "actor-idle",
  "title": "South-facing ranger idle loop",
  "family": "actor",
  "recipe_id": "actor-animation",
  "output_profile_id": "generic-pixel-actor-v1",
  "quality_rubric_version": "quality-rubric-v1",
  "prompt": "Use the approved identity master of a compact forest ranger with a moss-green hood, tan tunic, brown boots, a small round wooden buckler on the left arm, and a short iron sword in the right hand. Keep the ranger facing south and preserve face, body proportions, clothing, equipment hands, palette, outline, and foot root. Create a subtle idle cycle with ordered motion beats: settle, breath rise, settle return, breath fall. The character stays grounded; this is motion, not four unrelated poses. Crisp 32x32 pixel art per frame, transparent background, no text, no frame border.",
  "reference": {
    "mode": "identity_master",
    "continuity_group": "golden-ranger-v1",
    "max_images": 1
  },
  "generation": {
    "development_runs": 5,
    "release_runs": 20,
    "candidates_per_run": 1
  },
  "contract": {
    "kind": "animation",
    "canvas": {
      "width": 32,
      "height": 32
    },
    "transparent_background": true,
    "frame_count": 4,
    "directions": ["south"],
    "action": "idle",
    "loop": true,
    "states": [],
    "beats": [
      {
        "id": "settle",
        "semantic": "neutral grounded pose at the contact baseline"
      },
      {
        "id": "breath-rise",
        "semantic": "torso rises one subtle step without lifting the feet"
      },
      {
        "id": "settle-return",
        "semantic": "torso returns through the neutral grounded pose"
      },
      {
        "id": "breath-fall",
        "semantic": "torso compresses subtly before closing back to settle"
      }
    ],
    "pivot": {
      "x": 0.5,
      "y": 0.875
    }
  },
  "required_local_checks": [
    "canvas-size",
    "frame-count",
    "transparent-background",
    "required-reference-present",
    "non-empty-content",
    "frame-uniqueness",
    "pivot-drift",
    "bbox-scale-drift",
    "palette-consistency",
    "loop-closing-delta"
  ],
  "required_visual_checks": [
    "identity-consistency",
    "direction-readability",
    "action-readability",
    "temporal-continuity",
    "loop-naturalness",
    "equipment-consistency",
    "pixel-art-integrity"
  ],
  "required_metrics": [
    "provider-response-success",
    "local-qa-pass",
    "visual-qa-pass",
    "user-approval",
    "candidates-to-approval",
    "regenerated-frames",
    "manual-edit-seconds",
    "identity-score",
    "action-score",
    "direction-score",
    "loop-score",
    "export-contract-match"
  ]
}
